{
 "levels": [
  "A1",
  "A2",
  "B1",
  "B2",
  "C1"
 ],
 "layers": [
  {
   "id": "function",
   "name": "Functions",
   "desc": "What you are doing with the sentence"
  },
  {
   "id": "door",
   "name": "Doors",
   "desc": "Verb frames with one open slot"
  },
  {
   "id": "turn",
   "name": "Turns",
   "desc": "The same door rotated through time, polarity and mood"
  },
  {
   "id": "glue",
   "name": "Glue",
   "desc": "Connectors and prepositions, and the word-order rule each triggers"
  },
  {
   "id": "slot",
   "name": "Slot grammar",
   "desc": "What happens inside the slot: pronouns, articles, case, agreement"
  },
  {
   "id": "lexicon",
   "name": "Lexicon",
   "desc": "The words that fill the slots, by topic"
  },
  {
   "id": "sound",
   "name": "Sound",
   "desc": "Pronunciation, stress, intonation, listening"
  },
  {
   "id": "chunk",
   "name": "Chunks",
   "desc": "Fixed phrases with no slot"
  }
 ],
 "languages": [
  {
   "id": "khasi",
   "name": "Khasi",
   "native": "Ka Ktien Khasi",
   "script": "latin",
   "rtl": false,
   "translit": false,
   "full": true,
   "variety": "Standard Khasi (Sohra/Cherrapunji dialect as used in writing and Shillong), Latin script"
  },
  {
   "id": "german",
   "name": "German",
   "native": "Deutsch",
   "script": "latin",
   "rtl": false,
   "translit": false,
   "full": true,
   "variety": "Standard German (Germany), du and Sie both shown"
  },
  {
   "id": "hindi",
   "name": "Hindi",
   "native": "हिन्दी",
   "script": "devanagari",
   "rtl": false,
   "translit": true,
   "full": true,
   "variety": "Standard spoken Hindi (Hindustani register used in daily speech), Devanagari with simple roman transliteration"
  },
  {
   "id": "french",
   "name": "French",
   "native": "Français",
   "script": "latin",
   "rtl": false,
   "translit": false,
   "full": true,
   "variety": "Standard French (France), tu and vous both shown"
  },
  {
   "id": "swissgerman",
   "name": "Swiss German",
   "native": "Schwiizerdütsch",
   "script": "latin",
   "rtl": false,
   "translit": false,
   "full": true,
   "variety": "Zürich German (Züritüütsch) in the common informal spelling used in messages; Bernese and Basel differences noted only where large"
  },
  {
   "id": "bengali",
   "name": "Bengali",
   "native": "বাংলা",
   "script": "bengali",
   "rtl": false,
   "translit": true,
   "full": false,
   "variety": "Colloquial Kolkata Bengali (cholito bhasha), Bengali script with transliteration"
  },
  {
   "id": "spanish",
   "name": "Spanish",
   "native": "Español",
   "script": "latin",
   "rtl": false,
   "translit": false,
   "full": false,
   "variety": "Neutral Latin American Spanish, tú and usted"
  },
  {
   "id": "italian",
   "name": "Italian",
   "native": "Italiano",
   "script": "latin",
   "rtl": false,
   "translit": false,
   "full": false,
   "variety": "Standard spoken Italian, tu and Lei"
  },
  {
   "id": "portuguese",
   "name": "Portuguese",
   "native": "Português",
   "script": "latin",
   "rtl": false,
   "translit": false,
   "full": false,
   "variety": "Brazilian Portuguese, você"
  },
  {
   "id": "arabic",
   "name": "Arabic",
   "native": "العربية",
   "script": "arabic",
   "rtl": true,
   "translit": true,
   "full": false,
   "variety": "Modern Standard Arabic, Levantine spoken forms noted"
  }
 ],
 "items": [
  {
   "id": "F-GREET",
   "layer": "function",
   "level": "A1",
   "en": "Greet someone and say goodbye",
   "slot": "-",
   "note": "Formal and informal versions"
  },
  {
   "id": "F-INTRO",
   "layer": "function",
   "level": "A1",
   "en": "Introduce yourself: name, where you are from, what you do",
   "slot": "-",
   "note": ""
  },
  {
   "id": "F-THANK",
   "layer": "function",
   "level": "A1",
   "en": "Thank someone and respond to thanks",
   "slot": "-",
   "note": ""
  },
  {
   "id": "F-ASK-PRICE",
   "layer": "function",
   "level": "A1",
   "en": "Ask how much something costs",
   "slot": "-",
   "note": ""
  },
  {
   "id": "F-ASK-WAY",
   "layer": "function",
   "level": "A1",
   "en": "Ask where something is and understand a simple answer",
   "slot": "-",
   "note": ""
  },
  {
   "id": "F-NOT-UNDERSTAND",
   "layer": "function",
   "level": "A1",
   "en": "Say you don't understand, ask someone to repeat or slow down",
   "slot": "-",
   "note": "The most important A1 function: it keeps the conversation alive"
  },
  {
   "id": "F-LIKE",
   "layer": "function",
   "level": "A1",
   "en": "Say what you like and don't like",
   "slot": "-",
   "note": ""
  },
  {
   "id": "F-WANT",
   "layer": "function",
   "level": "A1",
   "en": "Say what you want, order food and drink",
   "slot": "-",
   "note": ""
  },
  {
   "id": "D-BE",
   "layer": "door",
   "level": "A1",
   "en": "I am ___",
   "slot": "N",
   "note": "Identity, origin, job, state. The first door in every language"
  },
  {
   "id": "D-HAVE",
   "layer": "door",
   "level": "A1",
   "en": "I have ___",
   "slot": "N",
   "note": "Possession; in many languages also age, hunger, fear"
  },
  {
   "id": "D-THERE-IS",
   "layer": "door",
   "level": "A1",
   "en": "There is / there are ___",
   "slot": "N",
   "note": "Existence"
  },
  {
   "id": "D-LIKE",
   "layer": "door",
   "level": "A1",
   "en": "I like ___",
   "slot": "N",
   "note": "In many languages the liked thing is the subject"
  },
  {
   "id": "D-WANT",
   "layer": "door",
   "level": "A1",
   "en": "I want ___ / I want to ___",
   "slot": "TO",
   "note": "Blunt in most languages; pair with D-WOULD-LIKE"
  },
  {
   "id": "D-WOULD-LIKE",
   "layer": "door",
   "level": "A1",
   "en": "I'd like ___ / I'd like to ___",
   "slot": "TO",
   "note": "The polite version of D-WANT, used for ordering"
  },
  {
   "id": "D-NEED",
   "layer": "door",
   "level": "A1",
   "en": "I need ___ / I need to ___",
   "slot": "TO",
   "note": ""
  },
  {
   "id": "D-CAN",
   "layer": "door",
   "level": "A1",
   "en": "I can ___",
   "slot": "V",
   "note": "Ability and permission"
  },
  {
   "id": "D-GOING-TO",
   "layer": "door",
   "level": "A1",
   "en": "I'm going to ___",
   "slot": "V",
   "note": "Intention and near future"
  },
  {
   "id": "D-WILL",
   "layer": "door",
   "level": "A1",
   "en": "I will ___",
   "slot": "V",
   "note": "Some languages use present tense plus a time word instead"
  },
  {
   "id": "T-PRES",
   "layer": "turn",
   "level": "A1",
   "en": "Present simple",
   "slot": "-",
   "note": "Habits, facts, and in many languages the default for now"
  },
  {
   "id": "T-PROG",
   "layer": "turn",
   "level": "A1",
   "en": "Present continuous (right now)",
   "slot": "-",
   "note": "Many languages have no separate form; note what is used instead"
  },
  {
   "id": "T-PAST",
   "layer": "turn",
   "level": "A1",
   "en": "Past simple, first verbs (was, went, had, did)",
   "slot": "-",
   "note": "Just enough to say what you did yesterday"
  },
  {
   "id": "T-FUT",
   "layer": "turn",
   "level": "A1",
   "en": "Future (going to / will)",
   "slot": "-",
   "note": ""
  },
  {
   "id": "T-NEG",
   "layer": "turn",
   "level": "A1",
   "en": "Negative",
   "slot": "-",
   "note": "Where the negation word goes and what it attaches to"
  },
  {
   "id": "T-Q",
   "layer": "turn",
   "level": "A1",
   "en": "Yes/no question",
   "slot": "-",
   "note": "Word order, particle, or intonation only"
  },
  {
   "id": "T-WH",
   "layer": "turn",
   "level": "A1",
   "en": "Wh-question (who, what, where, when, how much)",
   "slot": "-",
   "note": ""
  },
  {
   "id": "G-AND",
   "layer": "glue",
   "level": "A1",
   "en": "and",
   "slot": "-",
   "note": ""
  },
  {
   "id": "G-BUT",
   "layer": "glue",
   "level": "A1",
   "en": "but",
   "slot": "-",
   "note": ""
  },
  {
   "id": "G-OR",
   "layer": "glue",
   "level": "A1",
   "en": "or",
   "slot": "-",
   "note": ""
  },
  {
   "id": "G-BECAUSE",
   "layer": "glue",
   "level": "A1",
   "en": "because",
   "slot": "-",
   "note": "First subordinator; note any word-order change"
  },
  {
   "id": "G-THEN",
   "layer": "glue",
   "level": "A1",
   "en": "then / after that",
   "slot": "-",
   "note": ""
  },
  {
   "id": "G-ALSO",
   "layer": "glue",
   "level": "A1",
   "en": "also / too",
   "slot": "-",
   "note": ""
  },
  {
   "id": "G-IN",
   "layer": "glue",
   "level": "A1",
   "en": "in (place, month)",
   "slot": "-",
   "note": ""
  },
  {
   "id": "G-ON",
   "layer": "glue",
   "level": "A1",
   "en": "on (day, surface)",
   "slot": "-",
   "note": ""
  },
  {
   "id": "G-AT",
   "layer": "glue",
   "level": "A1",
   "en": "at (time, point)",
   "slot": "-",
   "note": ""
  },
  {
   "id": "G-FROM",
   "layer": "glue",
   "level": "A1",
   "en": "from",
   "slot": "-",
   "note": ""
  },
  {
   "id": "G-TO",
   "layer": "glue",
   "level": "A1",
   "en": "to (direction)",
   "slot": "-",
   "note": ""
  },
  {
   "id": "G-WITH",
   "layer": "glue",
   "level": "A1",
   "en": "with",
   "slot": "-",
   "note": ""
  },
  {
   "id": "S-PRON-SUBJ",
   "layer": "slot",
   "level": "A1",
   "en": "Subject pronouns (I, you, he, she, we, they)",
   "slot": "-",
   "note": "Include formal you if the language has one"
  },
  {
   "id": "S-PRON-OBJ",
   "layer": "slot",
   "level": "A1",
   "en": "Object pronouns (me, you, him, her, us, them)",
   "slot": "-",
   "note": ""
  },
  {
   "id": "S-ARTICLE",
   "layer": "slot",
   "level": "A1",
   "en": "Articles (a, the) or their absence",
   "slot": "-",
   "note": ""
  },
  {
   "id": "S-GENDER",
   "layer": "slot",
   "level": "A1",
   "en": "Noun gender and agreement, if any",
   "slot": "-",
   "note": "Mark not applicable if the language has none"
  },
  {
   "id": "S-PLURAL",
   "layer": "slot",
   "level": "A1",
   "en": "Plural formation",
   "slot": "-",
   "note": ""
  },
  {
   "id": "S-DEMONSTR",
   "layer": "slot",
   "level": "A1",
   "en": "this / that / these / those",
   "slot": "-",
   "note": ""
  },
  {
   "id": "S-NUMBERS",
   "layer": "slot",